{
  "source": "aoe2scout",
  "sourceUrl": "https://www.aoe2scout.com/d/current/civs/rm_4v4__e1200_1400__d90d.json",
  "map": "all",
  "mode": "4v4 RM",
  "fetchedAt": "2026-11-01",
  "patchNote": "One-time copy of aoe2scout static aggregate rm_4v4, Elo band 1200-1400, window 90d (2026-08-02 through 2026-10-30). Grid version 2026-10-30. Retrieved 2026-11-01. The file has no DE patch id. civ games are player appearances in that band, not matches. The source monthly trend runs outside this window and is omitted. aoestats.io returned HTTP 522 on retrieval.",
  "period": {
    "key": "90d",
    "from": "2026-08-02",
    "to": "2026-10-30"
  },
  "elo": {
    "min": 1200,
    "max": 1400
  },
  "sample": {
    "unit": "player",
    "note": "Published games and pick rates count player appearances in the Elo band, not completed matches. Bracket games is the sum of those appearances."
  },
  "brackets": [
    {
      "key": "1200-1400",
      "label": "1200-1400",
      "games": 867358,
      "civs": [
        {
          "en": "Persians",
          "winRate": 50.353638215145345,
          "playRate": 6.226955882115574,
          "games": 54010,
          "wins": 27196,
          "ci95Low": 49.93195279558343,
          "ci95High": 50.77527333143214
        },
        {
          "en": "Mongols",
          "winRate": 50.06766758299852,
          "playRate": 5.452189292080087,
          "games": 47290,
          "wins": 23677,
          "ci95Low": 49.61702868211682,
          "ci95High": 50.51829549083004
        },
        {
          "en": "Khmer",
          "winRate": 50.57499019045607,
          "playRate": 3.8197606985812085,
          "games": 33131,
          "wins": 16756,
          "ci95Low": 50.03658568287762,
          "ci95High": 51.11326137116715
        },
        {
          "en": "Franks",
          "winRate": 50.08440834527791,
          "playRate": 3.6196126628220413,
          "games": 31395,
          "wins": 15724,
          "ci95Low": 49.53134260931564,
          "ci95High": 50.637453426777626
        },
        {
          "en": "Spanish",
          "winRate": 50.535869783642575,
          "playRate": 3.442407863880889,
          "games": 29858,
          "wins": 15089,
          "ci95Low": 49.96872279055724,
          "ci95High": 51.10287890195192
        },
        {
          "en": "Vietnamese",
          "winRate": 48.495479692349214,
          "playRate": 3.4177352373529732,
          "games": 29644,
          "wins": 14376,
          "ci95Low": 47.92677866719814,
          "ci95High": 49.06457061200199
        },
        {
          "en": "Britons",
          "winRate": 48.858431400183214,
          "playRate": 3.272235916426666,
          "games": 28382,
          "wins": 13867,
          "ci95Low": 48.2770694756039,
          "ci95High": 49.440102313306525
        },
        {
          "en": "Magyars",
          "winRate": 50.442750442750445,
          "playRate": 2.9946112216639498,
          "games": 25974,
          "wins": 13102,
          "ci95Low": 49.83467945391032,
          "ci95High": 51.05069048382924
        },
        {
          "en": "Huns",
          "winRate": 50.53584555267536,
          "playRate": 2.9799690554534575,
          "games": 25847,
          "wins": 13062,
          "ci95Low": 49.926279837550666,
          "ci95High": 51.14525200766401
        },
        {
          "en": "Italians",
          "winRate": 50.03934219844205,
          "playRate": 2.930508509750299,
          "games": 25418,
          "wins": 12719,
          "ci95Low": 49.42469396492559,
          "ci95High": 50.653978541632725
        },
        {
          "en": "Japanese",
          "winRate": 49.216078170108815,
          "playRate": 2.5958139545608616,
          "games": 22515,
          "wins": 11081,
          "ci95Low": 48.56323220696489,
          "ci95High": 49.86919159941775
        },
        {
          "en": "Bohemians",
          "winRate": 48.81600372179577,
          "playRate": 2.4782154542876182,
          "games": 21495,
          "wins": 10493,
          "ci95Low": 48.148030213974444,
          "ci95High": 49.48440036312232
        },
        {
          "en": "Ethiopians",
          "winRate": 50.11209715086408,
          "playRate": 2.468415579264848,
          "games": 21410,
          "wins": 10729,
          "ci95Low": 49.442381061596365,
          "ci95High": 50.781773020126174
        },
        {
          "en": "Cumans",
          "winRate": 52.88642439845529,
          "playRate": 2.3286808907048764,
          "games": 20198,
          "wins": 10682,
          "ci95Low": 52.197530985516,
          "ci95High": 53.57422004138046
        },
        {
          "en": "Saracens",
          "winRate": 50.49071901002774,
          "playRate": 2.1615065520811476,
          "games": 18748,
          "wins": 9466,
          "ci95Low": 49.77499727529213,
          "ci95High": 51.20623968225555
        },
        {
          "en": "Koreans",
          "winRate": 50.89348377692598,
          "playRate": 2.135565706432638,
          "games": 18523,
          "wins": 9427,
          "ci95Low": 50.173425246264124,
          "ci95High": 51.61317177413681
        },
        {
          "en": "Hindustanis",
          "winRate": 49.22702702702703,
          "playRate": 2.1329139755441235,
          "games": 18500,
          "wins": 9107,
          "ci95Low": 48.506838049292845,
          "ci95High": 49.94753696005656
        },
        {
          "en": "Teutons",
          "winRate": 49.32689576824766,
          "playRate": 2.0297270561867187,
          "games": 17605,
          "wins": 8684,
          "ci95Low": 48.58859220772575,
          "ci95High": 50.06549302182166
        },
        {
          "en": "Turks",
          "winRate": 49.65483234714004,
          "playRate": 1.8705079102285331,
          "games": 16224,
          "wins": 8056,
          "ci95Low": 48.88563245018914,
          "ci95High": 50.42419566644715
        },
        {
          "en": "Poles",
          "winRate": 50.849787553111724,
          "playRate": 1.845143527816657,
          "games": 16004,
          "wins": 8138,
          "ci95Low": 50.0751272274228,
          "ci95High": 51.62404001071379
        },
        {
          "en": "Burgundians",
          "winRate": 49.53632148377125,
          "playRate": 1.7902642276891434,
          "games": 15528,
          "wins": 7692,
          "ci95Low": 48.750122312633856,
          "ci95High": 50.32275002466838
        },
        {
          "en": "Lithuanians",
          "winRate": 49.432812601283466,
          "playRate": 1.7786196703091457,
          "games": 15427,
          "wins": 7626,
          "ci95Low": 48.644087636714595,
          "ci95High": 50.22181997522019
        },
        {
          "en": "Celts",
          "winRate": 50.27837820134931,
          "playRate": 1.7601728467368722,
          "games": 15267,
          "wins": 7676,
          "ci95Low": 49.48528137923483,
          "ci95High": 51.071334963377225
        },
        {
          "en": "Varangians",
          "winRate": 49.069351526793405,
          "playRate": 1.7405730966913315,
          "games": 15097,
          "wins": 7408,
          "ci95Low": 48.27223593379621,
          "ci95High": 49.86694062706514
        },
        {
          "en": "Berbers",
          "winRate": 49.73254602292462,
          "playRate": 1.6596376582679817,
          "games": 14395,
          "wins": 7159,
          "ci95Low": 48.915929543581505,
          "ci95High": 50.54930521530354
        },
        {
          "en": "Dravidians",
          "winRate": 51.603456895936006,
          "playRate": 1.6142123552212582,
          "games": 14001,
          "wins": 7225,
          "ci95Low": 50.775334887222115,
          "ci95High": 52.43069923172145
        },
        {
          "en": "Mayans",
          "winRate": 50.664872566091496,
          "playRate": 1.4566073063256464,
          "games": 12634,
          "wins": 6401,
          "ci95Low": 49.793002198157325,
          "ci95High": 51.53633872347601
        },
        {
          "en": "Slavs",
          "winRate": 50.48569410102437,
          "playRate": 1.305573938327657,
          "games": 11324,
          "wins": 5717,
          "ci95Low": 49.56479999424471,
          "ci95High": 51.406258781859634
        },
        {
          "en": "Vikings",
          "winRate": 49.276776998846394,
          "playRate": 1.299232842724688,
          "games": 11269,
          "wins": 5553,
          "ci95Low": 48.354103684419236,
          "ci95High": 50.19994323840811
        },
        {
          "en": "Malay",
          "winRate": 50.03584229390681,
          "playRate": 1.2866659441660768,
          "games": 11160,
          "wins": 5584,
          "ci95Low": 49.10831882707322,
          "ci95High": 50.96334109328966
        },
        {
          "en": "Goths",
          "winRate": 48.81242662331798,
          "playRate": 1.276635483848653,
          "games": 11073,
          "wins": 5405,
          "ci95Low": 47.88195439245902,
          "ci95High": 49.743722587520544
        },
        {
          "en": "Portuguese",
          "winRate": 48.60892873648211,
          "playRate": 1.247351151427669,
          "games": 10819,
          "wins": 5259,
          "ci95Low": 47.66777720733317,
          "ci95High": 49.55106779544319
        },
        {
          "en": "Byzantines",
          "winRate": 45.16224479731729,
          "playRate": 1.1689521512455066,
          "games": 10139,
          "wins": 4579,
          "ci95Low": 44.19556595416352,
          "ci95High": 46.13258823883897
        },
        {
          "en": "Chinese",
          "winRate": 48.8875645609853,
          "playRate": 1.1607663732853102,
          "games": 10068,
          "wins": 4922,
          "ci95Low": 47.911731873266554,
          "ci95High": 49.864245858551634
        },
        {
          "en": "Malians",
          "winRate": 49.30139720558882,